"","deed","url"
"484","Petition of Thomas S. Mercer, 27 May 1862","https://civilwardc.org/texts/petitions/cww.00467.html"
"485","Petition of Susannah P. Bryan, 27 May 1862","https://civilwardc.org/texts/petitions/cww.00464.html"
"486","Petition of James L. Brawner, 27 May 1862","https://civilwardc.org/texts/petitions/cww.00475.html"
"487","Petition of Barnet T. Swart, 27 May 1862","https://civilwardc.org/texts/petitions/cww.00474.html"
"488","Petition of Catherine Golden, 27 May 1862","https://civilwardc.org/texts/petitions/cww.00476.html"
"489","Petition of Jane H. C. Scott, 27 May 1862","https://civilwardc.org/texts/petitions/cww.00463.html"
"490","Petition of Philip Fenwick, 27 May 1862","https://civilwardc.org/texts/petitions/cww.00487.html"
"491","Petition of Mary Jones, 28 May 1862","https://civilwardc.org/texts/petitions/cww.00536.html"
"492","Petition of Joseph W. Webb, 28 May 1862","https://civilwardc.org/texts/petitions/cww.00504.html"
"493","Petition of Oliver H. P. Clark, 28 May 1862","https://civilwardc.org/texts/petitions/cww.00503.html"
"494","Petition of Georgie Mechlin, 28 May 1862","https://civilwardc.org/texts/petitions/cww.00534.html"
"495","Petition of William Hamilton Williams, 28 May
                    1862","https://civilwardc.org/texts/petitions/cww.00500.html"
"496","Petition of Josiah Harding, 28 May 1862","https://civilwardc.org/texts/petitions/cww.00522.html"
"497","Petition of Mary C. Krafft, 28 May 1862","https://civilwardc.org/texts/petitions/cww.00556.html"
"498","Petition of Sarah G. Anderson through her Guardian
                    Joseph W. Webb, 28 May 1862","https://civilwardc.org/texts/petitions/cww.00505.html"
"499","Petition of Samuel Whitaker, 28 May 1862","https://civilwardc.org/texts/petitions/cww.00495.html"
"500","Petition of Francis J. Fugitt, 28 May 1862","https://civilwardc.org/texts/petitions/cww.00502.html"
"501","Petition of Margaret A. Wood, 28 May 1862","https://civilwardc.org/texts/petitions/cww.00514.html"
"502","Petition of William Nottingham, 28 May 1862","https://civilwardc.org/texts/petitions/cww.00501.html"
"503","Petition of John W. Mankin, 28 May 1862","https://civilwardc.org/texts/petitions/cww.00537.html"
"504","Petition of James Selden, 28 May 1862","https://civilwardc.org/texts/petitions/cww.00533.html"
"505","Petition of Robert L. McPherson, 28 May 1862","https://civilwardc.org/texts/petitions/cww.00538.html"
"506","Petition of James Selden, 28 May 1862","https://civilwardc.org/texts/petitions/cww.00532.html"
"507","Petition of Edward Hall, 28 May 1862","https://civilwardc.org/texts/petitions/cww.00507.html"
"508","Petition of Harriet White, 28 May 1862","https://civilwardc.org/texts/petitions/cww.00526.html"
"509","Petition of Ann Pickrel, 28 May 1862","https://civilwardc.org/texts/petitions/cww.00518.html"
"510","Petition of Hellen L. Stewart, 28 May 1862","https://civilwardc.org/texts/petitions/cww.00535.html"
"511","Petition of Isabella L. Turpin, 28 May 1862","https://civilwardc.org/texts/petitions/cww.00496.html"
"512","Petition of Jeremiah Stevens, 28 May 1862","https://civilwardc.org/texts/petitions/cww.00531.html"
"513","Petition of Theodore Bailey, 28 May 1862","https://civilwardc.org/texts/petitions/cww.00519.html"
"514","Petition of Jane C. Penn, 28 May 1862","https://civilwardc.org/texts/petitions/cww.00506.html"
"515","Petition of Martha T. Hall, 28 May 1862","https://civilwardc.org/texts/petitions/cww.00509.html"
"516","Petition of Samuel Byington, 28 May 1862","https://civilwardc.org/texts/petitions/cww.00528.html"
"517","Petition of Christopher Grammer, 28 May 1862","https://civilwardc.org/texts/petitions/cww.00515.html"
"518","Petition of Edward Owen, 28 May 1862","https://civilwardc.org/texts/petitions/cww.00523.html"
"519","Petition of Sallie E. Pearce, 28 May 1862","https://civilwardc.org/texts/petitions/cww.00530.html"
"520","Petition of Pierce Shoemaker, 28 May 1862","https://civilwardc.org/texts/petitions/cww.00494.html"
"521","Petition of Eliza Duvall, 28 May 1862","https://civilwardc.org/texts/petitions/cww.00510.html"
"522","Petition of Mary F. E. Purcell, 28 May 1862","https://civilwardc.org/texts/petitions/cww.00527.html"
"523","Petition of Rachel Harrison, 28 May 1862","https://civilwardc.org/texts/petitions/cww.00517.html"
"524","Petition of Henderson Fowler, 28 May 1862","https://civilwardc.org/texts/petitions/cww.00516.html"
"525","Petition of Elizabeth Crawford, 28 May 1862","https://civilwardc.org/texts/petitions/cww.00508.html"
"526","Petition of Jane S. Burruss, 28 May 1862","https://civilwardc.org/texts/petitions/cww.00497.html"
"527","Petition of John H. C. Coffin, 28 May 1862","https://civilwardc.org/texts/petitions/cww.00520.html"
"528","Petition of Rinaldo J. Bowen, 28 May 1862","https://civilwardc.org/texts/petitions/cww.00511.html"
"529","Petition of Benjamin F. Middleton, 28 May 1862","https://civilwardc.org/texts/petitions/cww.00499.html"
"530","Petition of Mary Ann Pursell and Thomas Pursell, 28 May
                    1862","https://civilwardc.org/texts/petitions/cww.00513.html"
"531","Petition of Ann Carroll, 28 May 1862","https://civilwardc.org/texts/petitions/cww.00521.html"
"532","Petition of John M. Belt, 28 May 1862","https://civilwardc.org/texts/petitions/cww.00512.html"
"533","Petition of Thomas W. Riley, 28 May 1862","https://civilwardc.org/texts/petitions/cww.00525.html"
"534","Petition of William H. Champion, 28 May 1862","https://civilwardc.org/texts/petitions/cww.00529.html"
"535","Petition of Andrew Hancock, 28 May 1862","https://civilwardc.org/texts/petitions/cww.00498.html"
"536","Petition of Sarah B. Adams, 28 May 1862","https://civilwardc.org/texts/petitions/cww.00539.html"
"537","Petition of William L. Hoyle, 28 May 1862","https://civilwardc.org/texts/petitions/cww.00540.html"
"538","Petition of Sophia Ridgely, 29 May 1862","https://civilwardc.org/texts/petitions/cww.00558.html"
"539","Petition of Mary E. Blake, 29 May 1862","https://civilwardc.org/texts/petitions/cww.00542.html"
"540","Petition of Sarah T. Simpson, 29 May 1862","https://civilwardc.org/texts/petitions/cww.00564.html"
"541","Petition of Henry M. Dellinger, 29 May 1862","https://civilwardc.org/texts/petitions/cww.00563.html"
"542","Petition of Theodore Sheckels, 29 May 1862","https://civilwardc.org/texts/petitions/cww.00543.html"
"543","Petition of George E. Moore, 29 May 1862","https://civilwardc.org/texts/petitions/cww.00560.html"
"544","Petition of Annie E. Taylor, 29 May 1862","https://civilwardc.org/texts/petitions/cww.00565.html"
"545","Petition of Henry P. C. Wilson, 29 May 1862","https://civilwardc.org/texts/petitions/cww.00554.html"
"546","Petition of Lois E. Offutt, 29 May 1862","https://civilwardc.org/texts/petitions/cww.00553.html"
"547","Petition of Frances P. T. Bronaugh, 29 May 1862","https://civilwardc.org/texts/petitions/cww.00557.html"
"548","Petition of Maria Clark, 29 May 1862","https://civilwardc.org/texts/petitions/cww.00561.html"
"549","Petition of William Tucker, 29 May 1862","https://civilwardc.org/texts/petitions/cww.00548.html"
"550","Petition of Anne M. Hurley, 29 May 1862","https://civilwardc.org/texts/petitions/cww.00559.html"
"551","Petition of Richard Southern, 29 May 1862","https://civilwardc.org/texts/petitions/cww.00544.html"
"552","Petition of Matilda Coyle, 29 May 1862","https://civilwardc.org/texts/petitions/cww.00555.html"
"553","Petition of Baker W. Johnson, 29 May 1862","https://civilwardc.org/texts/petitions/cww.00541.html"
"554","Petition of Violet A. Abell, 29 May 1862","https://civilwardc.org/texts/petitions/cww.00562.html"
"555","Petition of James T. Boiseau, 29 May 1862","https://civilwardc.org/texts/petitions/cww.00551.html"
"556","Petition of Julia Fenwick, 29 May 1862","https://civilwardc.org/texts/petitions/cww.00344.html"
"557","Petition of George F. Harbin, Julia A. Harbin,
                    Catharine A. Harbin, and Sarah P. Harbin, 29 May 1862","https://civilwardc.org/texts/petitions/cww.00552.html"
"558","Petition of Mary Hasson, 29 May 1862","https://civilwardc.org/texts/petitions/cww.00545.html"
"559","Petition of Alfred H. Boucher, 29 May 1862","https://civilwardc.org/texts/petitions/cww.00550.html"
"560","Petition of Patience W. Peck, 19 May 1862","https://civilwardc.org/texts/petitions/cww.00279.html"
"561","Petition of John A. Smith, 29 May 1862","https://civilwardc.org/texts/petitions/cww.00549.html"
"562","Petition of Catherine Thompson, 29 May 1862","https://civilwardc.org/texts/petitions/cww.00547.html"
"563","Petition of Nancy Parker, 29 May 1862","https://civilwardc.org/texts/petitions/cww.00546.html"
"564","Petition of Ann Blake, 30 May 1862","https://civilwardc.org/texts/petitions/cww.00601.html"
"565","Petition of Judson Richardson, 31 May 1862","https://civilwardc.org/texts/petitions/cww.00917.html"
"566","Petition of Andrew Wylie, 31 May 1862","https://civilwardc.org/texts/petitions/cww.00602.html"
"567","Petition of Henry Warrington, 2 June 1862","https://civilwardc.org/texts/petitions/cww.00580.html"
"568","Petition of Robert S. Patterson, 2 June 1862","https://civilwardc.org/texts/petitions/cww.00577.html"
"569","Petition of Laura V. Tayman, 2 June 1862","https://civilwardc.org/texts/petitions/cww.00596.html"
"570","Petition of Anna Cecil, 2 June 1862","https://civilwardc.org/texts/petitions/cww.00600.html"
"571","Petition of Richard W. Carter, 2 June 1862","https://civilwardc.org/texts/petitions/cww.00574.html"
"572","Petition of James J. Morrell, 2 June 1862","https://civilwardc.org/texts/petitions/cww.00609.html"
"573","Petition of Charles S. Middleton, 2 June 1862","https://civilwardc.org/texts/petitions/cww.00567.html"
"574","Petition of Alfred Y. Robinson, 2 June 1862","https://civilwardc.org/texts/petitions/cww.00594.html"
"575","Petition of John Robinson, 2 June 1862","https://civilwardc.org/texts/petitions/cww.00576.html"
"576","Petition of Elsey Curtis, 2 June 1862","https://civilwardc.org/texts/petitions/cww.00587.html"
"577","Petition of Walter Godey, 2 June 1862","https://civilwardc.org/texts/petitions/cww.00595.html"
"578","Petition of Elenora Knott, 2 June 1862","https://civilwardc.org/texts/petitions/cww.00566.html"
"579","Petition of George W. Wren and Catherine A. Wren, 2 June 1862","https://civilwardc.org/texts/petitions/cww.00607.html"
"580","Petition of James George Naylor, 2 June 1862","https://civilwardc.org/texts/petitions/cww.00585.html"
"581","Petition of Jacob G. Smoot, 2 June 1862","https://civilwardc.org/texts/petitions/cww.00589.html"
"582","Petition of Seth Hyatt, 2 June 1862","https://civilwardc.org/texts/petitions/cww.00579.html"
"583","Petition of James C. McGuire, 2 June 1862","https://civilwardc.org/texts/petitions/cww.00572.html"
"584","Petition of Hope Thomas, 2 June 1862","https://civilwardc.org/texts/petitions/cww.00593.html"
"585","Petition of Susanna G. Henshaw, 2 June 1862","https://civilwardc.org/texts/petitions/cww.00591.html"
"586","Petition of Nancy Allnutt, 2 June 1862","https://civilwardc.org/texts/petitions/cww.00568.html"
"587","Petition of A. Ross Ray and Albert Ray, 2 June
                    1862","https://civilwardc.org/texts/petitions/cww.00608.html"
"588","Petition of Fielder R. Dorsett, 2 June 1862","https://civilwardc.org/texts/petitions/cww.00588.html"
"589","Petition of Charles H. Mann, 2 June 1862","https://civilwardc.org/texts/petitions/cww.00578.html"
"590","Petition of Samuel B. Anderson, 2 June 1862","https://civilwardc.org/texts/petitions/cww.00611.html"
"591","Petition of Adam G. Herold, 2 June 1862","https://civilwardc.org/texts/petitions/cww.00592.html"
"592","Petition of Margaret J. Beall, 2 June 1862","https://civilwardc.org/texts/petitions/cww.00586.html"
"593","Petition of Edward Craycroft, 2 June 1862","https://civilwardc.org/texts/petitions/cww.00606.html"
"594","Petition of W. P. Clark, 2 June 1862","https://civilwardc.org/texts/petitions/cww.00612.html"
"595","Petition of Margaret Taylor, 2 June 1862","https://civilwardc.org/texts/petitions/cww.00597.html"
"596","Petition of Mary Key Wallace, 2 June 1862","https://civilwardc.org/texts/petitions/cww.00590.html"
"597","Petition of John P. Wheeler, 2 June 1862","https://civilwardc.org/texts/petitions/cww.00610.html"
"598","Petition of William S. Colquhoun, 2 June 1862","https://civilwardc.org/texts/petitions/cww.00575.html"
"599","Petition of the Sisters of the Visitation of Georgetown
                    D. C., 2 June 1862","https://civilwardc.org/texts/petitions/cww.00569.html"
"600","Petition of George W. Hopkins and John S. Hopkins, 2
                    June 1862","https://civilwardc.org/texts/petitions/cww.00571.html"
"601","Petition of Benjamin B. Hodges, 2 June 1862","https://civilwardc.org/texts/petitions/cww.00581.html"
"602","Petition of Lyde Griffith, 2 June 1862","https://civilwardc.org/texts/petitions/cww.00570.html"
"603","Petition of Philip Mackey, 2 June 1862","https://civilwardc.org/texts/petitions/cww.00573.html"
"604","Petition of Mary A. B. Cummin, 2 June 1862","https://civilwardc.org/texts/petitions/cww.00582.html"
"605","Petition of Eliza Kolp, 2 June 1862 ","https://civilwardc.org/texts/petitions/cww.00598.html"
"606","Petition of Christian Gittings, 2 June 1862","https://civilwardc.org/texts/petitions/cww.00599.html"
"607","Petition of Thomas McGuire, 3 June 1862","https://civilwardc.org/texts/petitions/cww.00617.html"
"608","Petition of Caroline E. Sanders, 3 June 1862","https://civilwardc.org/texts/petitions/cww.00616.html"
"609","Petition of Randolph Birch, 3 June 1862","https://civilwardc.org/texts/petitions/cww.00613.html"
"610","Petition of Judith C. Bayne, 3 June 1862","https://civilwardc.org/texts/petitions/cww.00619.html"
"611","Petition of Thomas J. S. Perry and Louis F. Perry, 4 June 1862","https://civilwardc.org/texts/petitions/cww.00622.html"
"612","Petition of George N. Cochran, 4 June 1862","https://civilwardc.org/texts/petitions/cww.00623.html"
"613","Petition of Eliza Jenkins, 5 June 1862","https://civilwardc.org/texts/petitions/cww.00628.html"
"614","Petition of James M. Cutts, 5 June 1862","https://civilwardc.org/texts/petitions/cww.00635.html"
"615","Petition of Joseph T. Jenkins, 5 June 1862","https://civilwardc.org/texts/petitions/cww.00629.html"
"616","Petition of John Hinsley, 5 June 1862","https://civilwardc.org/texts/petitions/cww.00634.html"
"617","Petition of Mary Queen and Elizabeth Queen, 5 June 1862","https://civilwardc.org/texts/petitions/cww.00627.html"
"618","Petition of Barbara Williams, 5 June 1862","https://civilwardc.org/texts/petitions/cww.00632.html"
"619","Petition of Jackson Beall, 5 June 1862","https://civilwardc.org/texts/petitions/cww.00630.html"
"620","Petition of Mary Walker, 5 June 1862","https://civilwardc.org/texts/petitions/cww.00637.html"
"621","Petition of Georgiana Monroe, 5 June 1862","https://civilwardc.org/texts/petitions/cww.00626.html"
"622","Petition of Allen Dodge, 5 June 1862","https://civilwardc.org/texts/petitions/cww.00636.html"
"623","Petition of Sarah T. Hughes, 5 June 1862","https://civilwardc.org/texts/petitions/cww.00633.html"
"624","Petition of George W. Beall, 5 June 14862","https://civilwardc.org/texts/petitions/cww.00631.html"
"625","Petition of William D. Shepherd, 6 June 1862","https://civilwardc.org/texts/petitions/cww.00638.html"
"626","Petition of Robert Read, 6 June 1862","https://civilwardc.org/texts/petitions/cww.00642.html"
"627","Petition of George D. Ramsay, 6 June 1862","https://civilwardc.org/texts/petitions/cww.00643.html"
"628","Petition of William G. H. White, 2 June 1862","https://civilwardc.org/texts/petitions/cww.00641.html"
"629","Petition of Jane E. Beall, Matilda B. Louisa Beall, and
               Margaret J. Beall, 6 June 1862","https://civilwardc.org/texts/petitions/cww.00639.html"
"630","Petition of Verlinda M. Wells, 6 June 1862","https://civilwardc.org/texts/petitions/cww.00701.html"
"631","Petition of Sarah Forrest, 6 June 1862","https://civilwardc.org/texts/petitions/cww.00644.html"
"632","Petition of Mary R. Stewart and Mary R. Patterson, 6
                    June 1862","https://civilwardc.org/texts/petitions/cww.00640.html"
"633","Petition of Terence Drury, 6 June 1862","https://civilwardc.org/texts/petitions/cww.00663.html"
"634","Petition of Rebecca Sears, 7 June 1862","https://civilwardc.org/texts/petitions/cww.00645.html"
"635","Petition of John B. Blake, 7 June 1862","https://civilwardc.org/texts/petitions/cww.00647.html"
"636","Petition of Thomas W. Williams, 7 June 1862","https://civilwardc.org/texts/petitions/cww.00646.html"
"637","Petition of William V. H. Brown, 8 June 1862","https://civilwardc.org/texts/petitions/cww.00858.html"
"638","Petition of Ellen M. Brooke, 10 June 1862","https://civilwardc.org/texts/petitions/cww.00648.html"
"639","Petition of Elizabeth Windsor, 10 June 1862","https://civilwardc.org/texts/petitions/cww.00650.html"
"640","Petition of Charles H. James, 10 June 1862","https://civilwardc.org/texts/petitions/cww.00649.html"
"641","Petition of Amelia Tilghman, 10 June 1862","https://civilwardc.org/texts/petitions/cww.00615.html"
"642","Petition of Charles J. Stewart, 11 June 1862","https://civilwardc.org/texts/petitions/cww.00651.html"
"643","Petition of John A. Peak, 11 June 1862","https://civilwardc.org/texts/petitions/cww.00652.html"
"644","Petition of Emanuel D. Etchison, 11 June 1862","https://civilwardc.org/texts/petitions/cww.00653.html"
"645","Petition of Mary M. Manning, 11 June 1862","https://civilwardc.org/texts/petitions/cww.00656.html"
"646","Petition of Daniel B. Clarke, 11 June 1862","https://civilwardc.org/texts/petitions/cww.00658.html"
"647","Petition of Emily Beale, 11 June 1862","https://civilwardc.org/texts/petitions/cww.00655.html"
"648","Petition of James E. Morgan, 11 June 1862","https://civilwardc.org/texts/petitions/cww.00657.html"
"649","Petition of Lucretia R. Higgins, 11 June 1862","https://civilwardc.org/texts/petitions/cww.00654.html"
"650","Petition of Mary E. Reintzell and Margaret Reintzell, 12 June 1862","https://civilwardc.org/texts/petitions/cww.00688.html"
"651","Petition of James W. Pumphrey, 12 June 1862","https://civilwardc.org/texts/petitions/cww.00660.html"
"652","Petition of Theodore Wheeler, 12 June 1862","https://civilwardc.org/texts/petitions/cww.00667.html"
"653","Petition of Lucy B. Walker, 12 June 1862","https://civilwardc.org/texts/petitions/cww.00669.html"
"654","Petition of Eliza B. Mills, 12 June 1862","https://civilwardc.org/texts/petitions/cww.00665.html"
"655","Petition of Samuel C. Crawford, 12 June 1862","https://civilwardc.org/texts/petitions/cww.00672.html"
"656","Petition of George W. Haller, 12 June 1862","https://civilwardc.org/texts/petitions/cww.00671.html"
"657","Petition of John Gibson, 12 June 1862","https://civilwardc.org/texts/petitions/cww.00668.html"
"658","Petition of Virginia Nicholls, 12 June 1862","https://civilwardc.org/texts/petitions/cww.00687.html"
"659","Petition of Myra M. Alexander, 12 June 1862","https://civilwardc.org/texts/petitions/cww.00659.html"
"660","Petition of Benjamin Ogle Tayloe, 12 June 1862","https://civilwardc.org/texts/petitions/cww.00664.html"
"661","Petition of Joseph Prather, 12 June 1862","https://civilwardc.org/texts/petitions/cww.00662.html"
"662","Petition of Robert Beale, 12 June 1862","https://civilwardc.org/texts/petitions/cww.00666.html"
"663","Petition of Conrad Schwarz, 12 June 1862","https://civilwardc.org/texts/petitions/cww.00673.html"
"664","Petition of Mary Eleanor Tolson, 12 June 1862","https://civilwardc.org/texts/petitions/cww.00670.html"
"665","Petition of John R. Ashby and Ellen G. Ashby, 12 June
                    1862","https://civilwardc.org/texts/petitions/cww.00661.html"
"666","Petition of James C. Pickett, 13 June 1862","https://civilwardc.org/texts/petitions/cww.00296.html"
"667","Petition of Nancy W. Davis, 13 June 1862","https://civilwardc.org/texts/petitions/cww.00764.html"
"668","Petition of Rachel E. White, 13 June 1862","https://civilwardc.org/texts/petitions/cww.00674.html"
"669","Petition of Henry M. Harman, 14 June 1862","https://civilwardc.org/texts/petitions/cww.00676.html"
"670","Petition of Benjamin Beall, 14 June 1862","https://civilwardc.org/texts/petitions/cww.00677.html"
"671","Petition of John Wilson, 14 June 1862","https://civilwardc.org/texts/petitions/cww.00675.html"
"672","Petition of Lettisha Harshman, 14 June 1862","https://civilwardc.org/texts/petitions/cww.00678.html"
"673","Petition of Leonard Harbaugh, 16 June 1862","https://civilwardc.org/texts/petitions/cww.00698.html"
"674","Petition of Olivia C. Wootton, 16 June 1862","https://civilwardc.org/texts/petitions/cww.00681.html"
"675","Petition of Peter G. Washington, 16 June 1862","https://civilwardc.org/texts/petitions/cww.00680.html"
"676","Petition of Josiah Dent (Administrator of William S.
                    Nicholls), 16 June 1862","https://civilwardc.org/texts/petitions/cww.00685.html"
"677","Petition of Thomas R. Brightwell, 16 June 1862","https://civilwardc.org/texts/petitions/cww.00691.html"
"678","Petition of James H. Shreve, 16 June 1862","https://civilwardc.org/texts/petitions/cww.00689.html"
"679","Petition of Charles Lyons, 16 June 1862","https://civilwardc.org/texts/petitions/cww.00690.html"
"680","Petition of Penelope Tyler, 16 June 1862","https://civilwardc.org/texts/petitions/cww.00684.html"
"681","Petition of John McGinnis, 16 June 1862","https://civilwardc.org/texts/petitions/cww.00679.html"
"682","Petition of Alexander A. Greer, 16 June 1862","https://civilwardc.org/texts/petitions/cww.00682.html"
"683","Petition of James L. Cassin, 16 June 1862","https://civilwardc.org/texts/petitions/cww.00693.html"
"684","Petition of Newton James Cox, 16 June 1862","https://civilwardc.org/texts/petitions/cww.00692.html"
"685","Petition of William McKnew, 16 June 1862","https://civilwardc.org/texts/petitions/cww.00683.html"
"686","Petition of Francis Mohun, 17 June 1862","https://civilwardc.org/texts/petitions/cww.00695.html"
"687","Petition of William B. Robertson, 17 June 1862","https://civilwardc.org/texts/petitions/cww.00710.html"
"688","Petition of William R. Birch, 17 June 1862","https://civilwardc.org/texts/petitions/cww.00702.html"
"689","Petition of Martha A. Linton, 17 June 1862","https://civilwardc.org/texts/petitions/cww.00707.html"
"690","Petition of Henry Naylor, Administrator of George
                    Naylor, 17 June 1862","https://civilwardc.org/texts/petitions/cww.00706.html"
"691","Petition of Jourdan W. Maury, 17 June 1862","https://civilwardc.org/texts/petitions/cww.00696.html"
"692","Petition of Leonora M. Williams, 17 June 1862","https://civilwardc.org/texts/petitions/cww.00708.html"
"693","Petition of James F. Essex, 17 June 1862","https://civilwardc.org/texts/petitions/cww.00709.html"
"694","Petition of Harriet R. Marshall, 17 June 1862","https://civilwardc.org/texts/petitions/cww.00697.html"
"695","Petition of George S. Krafft, 17 June 1862","https://civilwardc.org/texts/petitions/cww.00699.html"
"696","Petition of Woodford Stone, 17 June 1862","https://civilwardc.org/texts/petitions/cww.00704.html"
"697","Petition of Henry Naylor, 17 June 1862","https://civilwardc.org/texts/petitions/cww.00705.html"
"698","Petition of Barbara Ann Allnutt, 17 June 1862","https://civilwardc.org/texts/petitions/cww.00694.html"
"699","Petition of Bladen Forrest, 18 June 1862","https://civilwardc.org/texts/petitions/cww.00715.html"
"700","Petition of William Swann, 18 June 1862","https://civilwardc.org/texts/petitions/cww.00711.html"
"701","Petition of Nancy W. Balmain, 18 June 1862","https://civilwardc.org/texts/petitions/cww.00733.html"
"702","Petition of Mary H. Murray, 18 June 1862","https://civilwardc.org/texts/petitions/cww.00713.html"
"703","Petition of Thomas Orme, 18 June 1862","https://civilwardc.org/texts/petitions/cww.00712.html"
"704","Petition of Andrew Mercer, 18 June 1862 ","https://civilwardc.org/texts/petitions/cww.00716.html"
"705","Petition of John Marbury, Jr., Judson Mitchell, and
                    Charles A. Buckley, Trustees, 18 June 1862","https://civilwardc.org/texts/petitions/cww.00714.html"
"706","Petition of Lloyd Brooke, 19 June 1862","https://civilwardc.org/texts/petitions/cww.01098.html"
"707","Petition of Andrew J. Harding, 20 June 1862","https://civilwardc.org/texts/petitions/cww.00721.html"
"708","Petition of Lewis Carusi, 20 June 1862","https://civilwardc.org/texts/petitions/cww.00717.html"
"709","Petition of Elizabeth Minor, 20 June 1862","https://civilwardc.org/texts/petitions/cww.00731.html"
"710","Petition of Augustus E. Perry, Trustee, and Ellen R. Middleton, 20 June 1862","https://civilwardc.org/texts/petitions/cww.00725.html"
"711","Petition of Richard L. Ross, 20 June 1862","https://civilwardc.org/texts/petitions/cww.00734.html"
"712","Petition of Robert R. Aylmer, 20 June 1862","https://civilwardc.org/texts/petitions/cww.00728.html"
"713","Petition of Matilda W. Emory, 20 June 1862","https://civilwardc.org/texts/petitions/cww.00738.html"
"714","Petition of Mary M. Dufief, 20 June 1862","https://civilwardc.org/texts/petitions/cww.00736.html"
"715","Petition of John D. Hammack, 20 June 1862","https://civilwardc.org/texts/petitions/cww.00726.html"
"716","Petition of Zachariah Duvall, 20 June 1862","https://civilwardc.org/texts/petitions/cww.00718.html"
"717","Petition of Clark Mills, 20 June 1862","https://civilwardc.org/texts/petitions/cww.00741.html"
"718","Petition of Amos Denham, 20 June 1862","https://civilwardc.org/texts/petitions/cww.00737.html"
"719","Petition of Henry Naylor, Trustee of George Marbury, 20
                    June 1862","https://civilwardc.org/texts/petitions/cww.00729.html"
"720","Petition of Isabella Morton, 20 June 1862","https://civilwardc.org/texts/petitions/cww.00735.html"
"721","Petition of Mary Eliza Read, 20 June 1862","https://civilwardc.org/texts/petitions/cww.00739.html"
