"","deed","url"
"722","Petition of John M. Roberts, 20 June 1862","https://civilwardc.org/texts/petitions/cww.00722.html"
"723","Petition of Philip T. Berry, 20 June 1862","https://civilwardc.org/texts/petitions/cww.00740.html"
"724","Petition of Erasmus J. Middleton and Mary Jane Perry, 20 June 1862","https://civilwardc.org/texts/petitions/cww.00724.html"
"725","Petition of Ann Roberts, 20 June 1862","https://civilwardc.org/texts/petitions/cww.00723.html"
"726","Petition of Martina Maguire, 20 June 1862","https://civilwardc.org/texts/petitions/cww.00730.html"
"727","Petition of Emily Lang, 20 June 1862","https://civilwardc.org/texts/petitions/cww.00727.html"
"728","Petition of Ammon Green, 20 June 1862","https://civilwardc.org/texts/petitions/cww.00732.html"
"729","Petition of Edward M. Linthicum, 20 June 1862","https://civilwardc.org/texts/petitions/cww.00719.html"
"730","Petition of William P. Drury, 20 June 1862","https://civilwardc.org/texts/petitions/cww.00720.html"
"731","Petition of Virginia S. Wood, 21 June 1862","https://civilwardc.org/texts/petitions/cww.00749.html"
"732","Petition of Thomas B. Entwisle, 21 June 1862","https://civilwardc.org/texts/petitions/cww.00747.html"
"733","Petition of Ann Mariah Summers, 21 June 1862","https://civilwardc.org/texts/petitions/cww.00742.html"
"734","Petition of Leonard O. Cook, 21 June 1862","https://civilwardc.org/texts/petitions/cww.00604.html"
"735","Petition of John Little, 21 June 1862","https://civilwardc.org/texts/petitions/cww.00744.html"
"736","Petition of John Little, Guardian of Julia A. Little,
                    21 June 1862","https://civilwardc.org/texts/petitions/cww.00746.html"
"737","Petition of John Little, Guardian of John O. Little, 21
                    June 1862","https://civilwardc.org/texts/petitions/cww.00745.html"
"738","Petition of Anna M. Warring, 21 June 1862","https://civilwardc.org/texts/petitions/cww.00743.html"
"739","Petition of Joshua A. Ritchie, Acting Administrator of
                    Lewis Carbury, Mary S. Ritchie, Joseph F. Carbury, Pierce Shoemaker, and Martha
                    L. Shoemaker, 21 June 1862","https://civilwardc.org/texts/petitions/cww.00748.html"
"740","Petition of Catherine S. Lyons, 23 June 1862","https://civilwardc.org/texts/petitions/cww.00769.html"
"741","Petition of Ellen Scott, 23 June 1862 ","https://civilwardc.org/texts/petitions/cww.00750.html"
"742","Petition of Henry A. Willard, 23 June 1862","https://civilwardc.org/texts/petitions/cww.00766.html"
"743","Petition of Rosa E. Hall, 23 June 1862","https://civilwardc.org/texts/petitions/cww.00754.html"
"744","Petition of Sarah Crane, 23 June 1862","https://civilwardc.org/texts/petitions/cww.00768.html"
"745","Petition of Margaret Ann Miller, 23 June 1862","https://civilwardc.org/texts/petitions/cww.00752.html"
"746","Petition of Lemuel J. Middleton, 23 June 1862","https://civilwardc.org/texts/petitions/cww.00761.html"
"747","Petition of Mary E. Watts, 23 June 1862","https://civilwardc.org/texts/petitions/cww.00767.html"
"748","Petition of Harry W. Hall, 23 June 1862","https://civilwardc.org/texts/petitions/cww.00755.html"
"749","Petition of Caroline McAlister, 23 June 1862 ","https://civilwardc.org/texts/petitions/cww.00753.html"
"750","Petition of Frederick Cudlipp, 23 June 1862","https://civilwardc.org/texts/petitions/cww.00770.html"
"751","Petition of Edward Hall, 23 June 1862","https://civilwardc.org/texts/petitions/cww.00757.html"
"752","Petition of Jane E. Johns, 23 June 1862","https://civilwardc.org/texts/petitions/cww.00760.html"
"753","Petition of Mary Jane Turner and Rebecca H. Turner, 23 June 1862","https://civilwardc.org/texts/petitions/cww.00765.html"
"754","Petition of Thomas Young, 23 June 1862","https://civilwardc.org/texts/petitions/cww.00759.html"
"755","Petition of Sarah J. Sommervell, 23 June 1862","https://civilwardc.org/texts/petitions/cww.00771.html"
"756","Petition of Helen L. Joy, 23 June 1862","https://civilwardc.org/texts/petitions/cww.00756.html"
"757","Petition of Elisha J. Hall, 23 June 1862 ","https://civilwardc.org/texts/petitions/cww.00758.html"
"758","Petition of Susan Worthington, 23 June 1862","https://civilwardc.org/texts/petitions/cww.00763.html"
"759","Petition of Grace Dulaney, 23 June 1862","https://civilwardc.org/texts/petitions/cww.00751.html"
"760","Petition of Daniel W. Middleton, 23 June 1862 ","https://civilwardc.org/texts/petitions/cww.00762.html"
"761","Petition of Mary Thomas and Mary Catharine Thomas, 26 July 1862 Petition of Mary Thomas and Mary Catharine Thomas, 26 July 1862 Petition of Mary Thomas and Mary Catharine Thomas, 26 July 1862","https://civilwardc.org/texts/petitions/cww.01056.html"
"762","Petition of James White, 26 June 1862","https://civilwardc.org/texts/petitions/cww.00778.html"
"763","Petition of Julia Ann Billins and John Billins, 26 July 1862 Petition of Julia Ann Billins and John Billins, 26 July 1862 Petition of Julia Ann Billins and John Billins, 26 July 1862","https://civilwardc.org/texts/petitions/cww.01060.html"
"764","Petition of James E. Harrison, 28 June 1862","https://civilwardc.org/texts/petitions/cww.00793.html"
"765","Petition of Stephen Gough and Georgeanna Gough, 28 June
                    1862","https://civilwardc.org/texts/petitions/cww.00789.html"
"766","Petition of Joshua Peirce, 28 June 1862","https://civilwardc.org/texts/petitions/cww.00774.html"
"767","Petition of Thomas Knowles, 28 June 1862","https://civilwardc.org/texts/petitions/cww.00791.html"
"768","Petition of Rachel A. M. Tolson and John E. Turtow, 28
                    June 1862","https://civilwardc.org/texts/petitions/cww.00796.html"
"769","Petition of Jane C. Boone, 28 June 1862","https://civilwardc.org/texts/petitions/cww.00772.html"
"770","Petition of George W. Hatton, 28 June 1862","https://civilwardc.org/texts/petitions/cww.00781.html"
"771","Petition of Peter C. Howle, 28 June 1862","https://civilwardc.org/texts/petitions/cww.00777.html"
"772","Petition of Joshua Morsell, 28 June 1862","https://civilwardc.org/texts/petitions/cww.00785.html"
"773","Petition of Charles E. Sherman, 28 June 1862","https://civilwardc.org/texts/petitions/cww.00795.html"
"774","Petition of Mary G. Wilson, 28 June 1862","https://civilwardc.org/texts/petitions/cww.00784.html"
"775","Petition of Leah L. G. Wilson, 28 June 1862","https://civilwardc.org/texts/petitions/cww.00783.html"
"776","Petition of William Gunton, 28 June 1862","https://civilwardc.org/texts/petitions/cww.00775.html"
"777","Petition of Ann Green, 28 June 1862","https://civilwardc.org/texts/petitions/cww.00780.html"
"778","Petition of Rachael Piles, 28 June 1862 ","https://civilwardc.org/texts/petitions/cww.00776.html"
"779","Petition of Rebecca Williams, 28 June 1862","https://civilwardc.org/texts/petitions/cww.00790.html"
"780","Petition of Verlinda Shaw, 28 June 1862","https://civilwardc.org/texts/petitions/cww.00794.html"
"781","Petition of Charles H. Liebermann, 28 June 1862","https://civilwardc.org/texts/petitions/cww.00782.html"
"782","Petition of Henry Kengla, 28 June 1862","https://civilwardc.org/texts/petitions/cww.00797.html"
"783","Petition of Henry Weaver Guardian of Henry S. Barnes,
                    Angeline Barnes, and Theodore Barnes, 28 June 1862","https://civilwardc.org/texts/petitions/cww.00787.html"
"784","Petition of Henry Weaver, 28 June 1862","https://civilwardc.org/texts/petitions/cww.00786.html"
"785","Petition of Samuel Riggs, 28 June 1862","https://civilwardc.org/texts/petitions/cww.00788.html"
"786","Petition of Mary Rebecca Bibb, 28 June 1862","https://civilwardc.org/texts/petitions/cww.00792.html"
"787","Petition of Thomas Blagden, 28 June 1862","https://civilwardc.org/texts/petitions/cww.00802.html"
"788","Petition of Ann Macdaniel, 30 June 1862","https://civilwardc.org/texts/petitions/cww.00805.html"
"789","Petition of Philip Meredith, 30 June 1862","https://civilwardc.org/texts/petitions/cww.01028.html"
"790","Petition of Charles H. Wiltberger, 30 June 1862","https://civilwardc.org/texts/petitions/cww.00813.html"
"791","Petition of John F. Bridget, 30 June 1862","https://civilwardc.org/texts/petitions/cww.00801.html"
"792","Petition of Presley W. Dorsey, 30 June 1862","https://civilwardc.org/texts/petitions/cww.00803.html"
"793","Petition of Lucinda S. Matthews, 30 June 1862","https://civilwardc.org/texts/petitions/cww.00799.html"
"794","Petition of Cornelia Munson, 30 June 1862","https://civilwardc.org/texts/petitions/cww.00812.html"
"795","Petition of Fitzhugh Coyle, 30 June 1862","https://civilwardc.org/texts/petitions/cww.00809.html"
"796","Petition of Sarah Dorsey, 30 June 1862","https://civilwardc.org/texts/petitions/cww.00804.html"
"797","Petition of Lucinda S. Matthews, 30 June 1862","https://civilwardc.org/texts/petitions/cww.00800.html"
"798","Petition of Esau Pickrell, 30 June 1862","https://civilwardc.org/texts/petitions/cww.00807.html"
"799","Petition of Frederick Bates, 30 June 1862","https://civilwardc.org/texts/petitions/cww.00814.html"
"800","Petition of John McKenney, 30 June 1862","https://civilwardc.org/texts/petitions/cww.00808.html"
"801","Petition of John S. Johns, Lucy M. Johns, William S.
                    Darrell, and Virginia E. Darrell, 30 June 1862","https://civilwardc.org/texts/petitions/cww.00811.html"
"802","Petition of William F. Dickinson, 30 June 1862","https://civilwardc.org/texts/petitions/cww.00798.html"
"803","Petition of Joseph Ingle, 30 June 1862","https://civilwardc.org/texts/petitions/cww.00806.html"
"804","Petition of Phineas F. Wood, Mary E. Wood, Elizabeth M.
                    Clements, and Asbury Lloyd, 30 June 1862","https://civilwardc.org/texts/petitions/cww.00810.html"
"805","Petition of Clementina S. Young, 1 July 1862","https://civilwardc.org/texts/petitions/cww.00818.html"
"806","Petition of Martha Isherwood, 1 July 1862","https://civilwardc.org/texts/petitions/cww.00823.html"
"807","Petition of Thomas C. Cox, 1 July 1862","https://civilwardc.org/texts/petitions/cww.00822.html"
"808","Petition of Rebecca R. Darby, Ruth E. Darby, and James A. Darby, 1 July 1862","https://civilwardc.org/texts/petitions/cww.00824.html"
"809","Petition of Mary C. Young, 1 July 1862","https://civilwardc.org/texts/petitions/cww.00817.html"
"810","Petition of Isabel Maury, 1 July 1862","https://civilwardc.org/texts/petitions/cww.00833.html"
"811","Petition of J. Fenwick Young, 1 July 1862","https://civilwardc.org/texts/petitions/cww.00816.html"
"812","Petition of Maria Watterston, 1 July 1862","https://civilwardc.org/texts/petitions/cww.00825.html"
"813","Petition of William Pressey, 1 July 1862","https://civilwardc.org/texts/petitions/cww.00820.html"
"814","Petition of William S. Johnston, 1 July 1862","https://civilwardc.org/texts/petitions/cww.00828.html"
"815","Petition of Benjamin H. Clements, 1 July 1862","https://civilwardc.org/texts/petitions/cww.00819.html"
"816","Petition of David A. Watterston, 1 July 1862","https://civilwardc.org/texts/petitions/cww.00826.html"
"817","Petition of Thomas Lyddane, 1 July 1862","https://civilwardc.org/texts/petitions/cww.00835.html"
"818","Petition of Rebecca S. Harrison, 1 July 1862","https://civilwardc.org/texts/petitions/cww.00832.html"
"819","Petition of Mary Johnston, 1 July 1862","https://civilwardc.org/texts/petitions/cww.00827.html"
"820","Petition of William Jones, 1 July 1862","https://civilwardc.org/texts/petitions/cww.00815.html"
"821","Petition of Jane Johnston, 1 July 1862","https://civilwardc.org/texts/petitions/cww.00830.html"
"822","Petition of John A. Ruff, 1 July 1862","https://civilwardc.org/texts/petitions/cww.00831.html"
"823","Petition of William S. Johnston, 1 July 1862","https://civilwardc.org/texts/petitions/cww.00829.html"
"824","Petition of Samuel Higgins, 1 July 1862","https://civilwardc.org/texts/petitions/cww.00821.html"
"825","Petition of James W. McDaniel, 1 July 1862","https://civilwardc.org/texts/petitions/cww.00834.html"
"826","Petition of James W. Fling, 2 July 1862","https://civilwardc.org/texts/petitions/cww.00837.html"
"827","Petition of Joseph Holt, 2 July 1862","https://civilwardc.org/texts/petitions/cww.00836.html"
"828","Petition of Mahlon Falconer, 2 July 1862","https://civilwardc.org/texts/petitions/cww.00839.html"
"829","Petition of Dorothy Williams, 2 July 1862","https://civilwardc.org/texts/petitions/cww.00838.html"
"830","Petition of Henry Naylor as Trustee Under the Will of
                    John L. Brightwell, 3 July 1862","https://civilwardc.org/texts/petitions/cww.00841.html"
"831","Petition of Thomas C. Bowie, 3 July 1862","https://civilwardc.org/texts/petitions/cww.00840.html"
"832","Petition of Edwin Wallace, Eliza Wallace, Mary Wallace,
                    William Wallace, Roberta A. Robinson, & Emma Williams, 4 July 1862","https://civilwardc.org/texts/petitions/cww.00965.html"
"833","Petition of Richard Smyth Chilton, 5 July 1862","https://civilwardc.org/texts/petitions/cww.00843.html"
"834","Petition of Eleanor H. Callis, 5 July 1862","https://civilwardc.org/texts/petitions/cww.00846.html"
"835","Petition of William Brown, 5 July 1862","https://civilwardc.org/texts/petitions/cww.00845.html"
"836","Petition of James L. Barbour, 5 July 1862","https://civilwardc.org/texts/petitions/cww.00844.html"
"837","Petition of Christopher S. O'Hare, 7 July 1862","https://civilwardc.org/texts/petitions/cww.00850.html"
"838","Petition of Susan M. Burche, 7 July 1862","https://civilwardc.org/texts/petitions/cww.00853.html"
"839","Petition of Ellen J. King, 7 July 1862","https://civilwardc.org/texts/petitions/cww.00852.html"
"840","Petition of Lorenzo Thomas, 7 July 1862","https://civilwardc.org/texts/petitions/cww.00847.html"
"841","Petition of James H. Fowler, 7 July 1862","https://civilwardc.org/texts/petitions/cww.00851.html"
"842","Petition of George Parker & Thomas Parker, 7 July
                    1862","https://civilwardc.org/texts/petitions/cww.00849.html"
"843","Petition of Abel G. Davis, 7 July 1862","https://civilwardc.org/texts/petitions/cww.00855.html"
"844","Petition of Simeon M. Johnson, 7 July 1862","https://civilwardc.org/texts/petitions/cww.00848.html"
"845","Petition of William E. Howard, 7 July 1862","https://civilwardc.org/texts/petitions/cww.00854.html"
"846","Petition of Robert M. Sutton, 8 July 1862","https://civilwardc.org/texts/petitions/cww.00863.html"
"847","Petition of Sarah E. Sollers, 8 July 1862","https://civilwardc.org/texts/petitions/cww.00861.html"
"848","Petition of George J. Johsnon, 8 July 1862","https://civilwardc.org/texts/petitions/cww.00862.html"
"849","Petition of John H. Smoot, 8 July 1862","https://civilwardc.org/texts/petitions/cww.00860.html"
"850","Petition of William B. Jones, 8 July 1862","https://civilwardc.org/texts/petitions/cww.00859.html"
"851","Petition of Charles Homiller, 8 July 1862","https://civilwardc.org/texts/petitions/cww.00857.html"
"852","Petition of Horace Sprigg, 8 July 1862","https://civilwardc.org/texts/petitions/cww.00856.html"
"853","Petition of Erastus M. Chassin, 9 July 1862","https://civilwardc.org/texts/petitions/cww.00875.html"
"854","Petition of Joseph Weaver, 9 July 1862","https://civilwardc.org/texts/petitions/cww.00873.html"
"855","Petition of Elizabeth Williams, 9 July 1862","https://civilwardc.org/texts/petitions/cww.00866.html"
"856","Petition of Lizzie R. Nailor, 9 July 1862","https://civilwardc.org/texts/petitions/cww.00865.html"
"857","Petition of Arian Tweedy, 9 July 1862","https://civilwardc.org/texts/petitions/cww.00877.html"
"858","Petition of Elisha Jones, 9 July 1862","https://civilwardc.org/texts/petitions/cww.00868.html"
"859","Petition of Ariana J. Lyles, 9 July 1862","https://civilwardc.org/texts/petitions/cww.00867.html"
"860","Petition of Alison Nailor, Jr., 9 July 1862","https://civilwardc.org/texts/petitions/cww.00864.html"
"861","Petition of Alexander McD. Davis and Martha A. Davis, 9 July 1862","https://civilwardc.org/texts/petitions/cww.00878.html"
"862","Petition of William J. Williams, 9 July 1862","https://civilwardc.org/texts/petitions/cww.00876.html"
"863","Petition of Rebecca S. Weaver, 9 July 1862","https://civilwardc.org/texts/petitions/cww.00874.html"
"864","Petition of James L. Addison, 9 July 1862","https://civilwardc.org/texts/petitions/cww.00869.html"
"865","Petition of Catharine Chisholm, 9 July 1862","https://civilwardc.org/texts/petitions/cww.00871.html"
"866","Petition of Elizabeth Goszler, 9 July 1862","https://civilwardc.org/texts/petitions/cww.00870.html"
"867","Petition of Joseph Weaver and Thomas Weaver, 9 July 1862","https://civilwardc.org/texts/petitions/cww.00872.html"
"868","Petition of Joseph S. Wilson, 11 July 1862","https://civilwardc.org/texts/petitions/cww.00890.html"
"869","Petition of Eliza M. Mosher, 11 July 1862","https://civilwardc.org/texts/petitions/cww.00885.html"
"870","Petition of Ignatius Fenwick Young, 11 July 1862","https://civilwardc.org/texts/petitions/cww.00889.html"
"871","Petition of John B. Semmes, 11 July 1862","https://civilwardc.org/texts/petitions/cww.00884.html"
"872","Petition of Anna M. Hamilton, 11 July 1862","https://civilwardc.org/texts/petitions/cww.00881.html"
"873","Petition of Egbert Thompson, 11 July 1862","https://civilwardc.org/texts/petitions/cww.00618.html"
"874","Petition of Thomas C. Magruder, 11 July 1862","https://civilwardc.org/texts/petitions/cww.00891.html"
"875","Petition of Harriet E. Muncaster and Julian Magruder, 11 July 1862","https://civilwardc.org/texts/petitions/cww.00882.html"
"876","Petition of Columbus Alexander, 11 July 1862","https://civilwardc.org/texts/petitions/cww.00893.html"
"877","Petition of Martha E. Nixon, 11 July 1862","https://civilwardc.org/texts/petitions/cww.00895.html"
"878","Petition of Eleanor B. M. Hilleary and William H. Tuck, 11 July 1862","https://civilwardc.org/texts/petitions/cww.00880.html"
"879","Petition of Cornelius S. Wildman, 11 July 1862","https://civilwardc.org/texts/petitions/cww.00887.html"
"880","Petition of Charles E. Mix, 11 July 1862","https://civilwardc.org/texts/petitions/cww.00896.html"
"881","Petition of John W. Clarke, 11 July 1862","https://civilwardc.org/texts/petitions/cww.00894.html"
"882","Petition of Thomas H. Nelson, 11 July 1862","https://civilwardc.org/texts/petitions/cww.00892.html"
"883","Petition of Eliza Beston, 11 July 1862","https://civilwardc.org/texts/petitions/cww.00888.html"
"884","Petition of Eleanor B. M. Hilleary, 11 July 1862","https://civilwardc.org/texts/petitions/cww.00879.html"
"885","Petition of Theodore Mosher, 11 July 1862","https://civilwardc.org/texts/petitions/cww.00886.html"
"886","Petition of George W. Hopkins, 11 July 1862","https://civilwardc.org/texts/petitions/cww.00883.html"
"887","Petition of Eleanor H. Brauner, 12 July 1862","https://civilwardc.org/texts/petitions/cww.00908.html"
"888","Petition of Mary A. Holmead, 12 July 1862","https://civilwardc.org/texts/petitions/cww.00899.html"
"889","Petition of Landon W. Worthington, 12 July 1862","https://civilwardc.org/texts/petitions/cww.00897.html"
"890","Petition of James Selden, 12 July 1862","https://civilwardc.org/texts/petitions/cww.00909.html"
"891","Petition of Edmund Fitzhugh and Cora Fitzhugh, 12 July
                    1862","https://civilwardc.org/texts/petitions/cww.00907.html"
"892","Petition of Abraham F. Kimmell, 12 July 1862","https://civilwardc.org/texts/petitions/cww.00902.html"
"893","Petition of Thomas Murphy, 12 July 1862","https://civilwardc.org/texts/petitions/cww.00900.html"
"894","Petition of Caroline Lashley, Matilda Lloyd, Samuel E. Douglass, and Elizabeth E. Wheeler, 12 July 1862","https://civilwardc.org/texts/petitions/cww.00903.html"
"895","Petition of Nancy Woodland, 12 July 1862","https://civilwardc.org/texts/petitions/cww.00910.html"
"896","Petition of Samuel Cooper, 12 July 1862","https://civilwardc.org/texts/petitions/cww.00904.html"
"897","Petition of Susan W. Harris, 12 July 1862","https://civilwardc.org/texts/petitions/cww.00912.html"
"898","Petition of Robert Bowie, 12 July 1862","https://civilwardc.org/texts/petitions/cww.00914.html"
"899","Petition of Thomas Brown, 12 July 1862","https://civilwardc.org/texts/petitions/cww.00898.html"
"900","Petition of Ann R. O'Neale, 12 July 1862","https://civilwardc.org/texts/petitions/cww.00905.html"
"901","Petition of Sophia Baker, 12 July 1862","https://civilwardc.org/texts/petitions/cww.00911.html"
"902","Petition of William Cammack, 12 July 1862","https://civilwardc.org/texts/petitions/cww.00906.html"
"903","Petition of William A. Marks, 12 July 1862","https://civilwardc.org/texts/petitions/cww.00913.html"
"904","Petition of Mary A. Edmonston, 12 July 1862","https://civilwardc.org/texts/petitions/cww.00901.html"
"905","Petition of Eliza Dashiell, 14 July 1862","https://civilwardc.org/texts/petitions/cww.00922.html"
"906","Petition of Joshua Peirce, 14 July 1862","https://civilwardc.org/texts/petitions/cww.00929.html"
"907","Petition of Catharine McKnight, 14 July 1862","https://civilwardc.org/texts/petitions/cww.00928.html"
"908","Petition of Charlotte Maria Dawes, 14 July 1862","https://civilwardc.org/texts/petitions/cww.00920.html"
"909","Petition of Catharine Bates, 14 July 1862","https://civilwardc.org/texts/petitions/cww.00921.html"
"910","Petition of Harrison Wallace, 14 July 1862 ","https://civilwardc.org/texts/petitions/cww.00918.html"
"911","Petition of Charles Edmonston, 14 July 1862 ","https://civilwardc.org/texts/petitions/cww.00923.html"
"912","Petition of Rachel Brown, 14 July 1862","https://civilwardc.org/texts/petitions/cww.00924.html"
"913","Petition of Phoebe P. Dulaney and Rosa R. Dulaney, 14 July 1862","https://civilwardc.org/texts/petitions/cww.00932.html"
"914","Petition of Alanson Morehouse, 14 July 1862","https://civilwardc.org/texts/petitions/cww.00927.html"
"915","Petition of Greenberry M. Watkins, 14 July 1862","https://civilwardc.org/texts/petitions/cww.00926.html"
"916","Petition of Henry E. Marks, 14 July 1862","https://civilwardc.org/texts/petitions/cww.00919.html"
"917","Petition of Henry Tolson, 14 July 1862","https://civilwardc.org/texts/petitions/cww.00925.html"
"918","Petition of Sarah M. Holcomb, guardian of Florence Holcomb, 14 July 1862","https://civilwardc.org/texts/petitions/cww.00931.html"
"919","Petition of Josiah Burgess, 14 July 1862","https://civilwardc.org/texts/petitions/cww.00916.html"
"920","Petition of Caroline R. Dulaney, 14 July 1862","https://civilwardc.org/texts/petitions/cww.00933.html"
"921","Petition of Thomas T. Barnes, 14 July 1862","https://civilwardc.org/texts/petitions/cww.00945.html"
"922","Petition of Truman Lynch, 14 July 1862","https://civilwardc.org/texts/petitions/cww.00930.html"
"923","Petition of Sarah A. Stone, 14 July 1862","https://civilwardc.org/texts/petitions/cww.00915.html"
"924","Petition of Ann E. Jones, 15 July 1862","https://civilwardc.org/texts/petitions/cww.00955.html"
"925","Petition of Joseph H. Bradley, 15 July 1862","https://civilwardc.org/texts/petitions/cww.00941.html"
"926","Petition of Ellen J. Abbot, 15 July 1862","https://civilwardc.org/texts/petitions/cww.00960.html"
"927","Petition of John Frederick May, 15 July 1862","https://civilwardc.org/texts/petitions/cww.00964.html"
"928","Petition of Luther O. Sullivan and Samuel S. Williams,
                    15 July 1862","https://civilwardc.org/texts/petitions/cww.00934.html"
"929","Petition of Thomas P. Trott, 15 July 1862","https://civilwardc.org/texts/petitions/cww.00935.html"
"930","Petition of Dennis Johnston, 15 July 1862","https://civilwardc.org/texts/petitions/cww.00938.html"
"931","Petition of A. Thomas Bradley, 15 July 1862","https://civilwardc.org/texts/petitions/cww.00942.html"
"932","Petition of Albert B. Berry, 15 July 1862","https://civilwardc.org/texts/petitions/cww.00962.html"
"933","Petition of Elizabeth Bohrer, 15 July 1862","https://civilwardc.org/texts/petitions/cww.00954.html"
"934","Petition of Virginia Scott, 15 July 1862","https://civilwardc.org/texts/petitions/cww.00936.html"
"935","Petition of Mary A. Smith, 15 July 1862","https://civilwardc.org/texts/petitions/cww.00943.html"
"936","Petition of Ann Sheehy, 15 July 1862","https://civilwardc.org/texts/petitions/cww.00957.html"
"937","Petition of Eugenia Sweeny, 15 July 1862","https://civilwardc.org/texts/petitions/cww.00949.html"
"938","Petition of Joseph T. Mitchell, 15 July 1862","https://civilwardc.org/texts/petitions/cww.00958.html"
"939","Petition of William Noyes, 15 July 1862","https://civilwardc.org/texts/petitions/cww.00939.html"
"940","Petition of Allison Nailor, 15 July 1862","https://civilwardc.org/texts/petitions/cww.00959.html"
"941","Petition of Thomas T. Barnes, 15 July 1862","https://civilwardc.org/texts/petitions/cww.00946.html"
"942","Petition of Virginia Bell, Esther E. Bell, and Virginia C. Bell, 15 July 1862","https://civilwardc.org/texts/petitions/cww.00953.html"
"943","Petition of Andrew P. Hoover, 15 July 1862","https://civilwardc.org/texts/petitions/cww.00950.html"
"944","Petition of Delilah Clark, 15 July 1862","https://civilwardc.org/texts/petitions/cww.00961.html"
"945","Petition of Philip R. Fendall, 15 July 1862","https://civilwardc.org/texts/petitions/cww.00940.html"
"946","Petition of Nathan Prather, 15 July 1862","https://civilwardc.org/texts/petitions/cww.00956.html"
"947","Petition of Martha E. Harris, 15 July 1862","https://civilwardc.org/texts/petitions/cww.00937.html"
"948","Petition of Robert Dick, 15 July 1862","https://civilwardc.org/texts/petitions/cww.00947.html"
"949","Petition of Susan Keene, 15 July 1862","https://civilwardc.org/texts/petitions/cww.00948.html"
"950","Petition of Matilda Hamilton, 15 July 1862","https://civilwardc.org/texts/petitions/cww.00963.html"
"951","Petition of William Wilson, 15 July 1862","https://civilwardc.org/texts/petitions/cww.00951.html"
"952","Petition of Charles Leuman, 15 July 1862","https://civilwardc.org/texts/petitions/cww.00944.html"
